1,bet,0,Reante,Everyone must reante.
198,deal,110,The high hand can kill,"If the player with the high hand showing wants, there is a redeal."
199,deal,110,The low hand can kill,"If the player with the low hand showing wants, there is a redeal."
200,deal,110,Up wilds kill,"If any player gets a wild card specific to them face up, redeal."
201,deal,110,You flip QS to kill the game,"Before any betting round, any player may flip the queen of spades to force a redeal."
202,deal,110,"If no one opens, redeal","If no one opened in the previous round of betting, redeal."
203,deal,110,"If no one opens, redeal and increase the hand restriction","If no one opened in the previous round of betting, redeal and increase the restriction to open betting by one step."
204,deal,110,"If no one opens, redeal and decrease the hand restriction","If no one opened in the previous round of betting, redeal and decrease the restriction to open betting by one step."
205,deal,110,"If no one opens, redeal and oscillate the hand restriction","If no one opened in the previous round of betting, redeal and increase the restriction to open betting by one step up to a pair of aces, then decrease one step down to a pair of jacks, and so on."
206,deal,110,10D can force a redeal,"If a player is ever dealt the ten of diamonds face up, they can call for a redeal."
207,deal,110,Up KD kills the game,"If any player is ever dealt a face up King of Diamonds, redeal."
208,deal,110,Up KH kills the game,"If any player is ever dealt a face up King of Hearts, redeal."
209,deal,110,No queens means redeal,"If no queens were dealt face up, redeal."
210,deal,110,Up black queen forces redeal,"If a black queen is ever dealt face up, redeal."
211,deal,110,Up pair of sevens forces redeal,"If a natural pair of sevens is ever dealt face up to one player, redeal."
212,deal,110,Up pair of eights forces a redeal,"If a natural pair of eights is ever dealt face up to one player, redeal."
213,deal,110,"If no one's matched, redeal","If no one has had to match the pot by this point, redeal."
214,deal,110,Black eights force redeal,"If a player is ever dealt a black eight, redeal the game."
215,deal,110,"If the table card is a joker, redeal","If the table card is a joker, redeal for everyone still in."
216,deal,111,Get one down or a new hand,"Each player in betting order may choose to get dealt an extra card, or discard their hand a new one of the same size."
217,deal,114,Deal the deck,"Deal the deck completely out, except each player gets the same number of cards."
218,deal,116,Deal until a match,"Deal one card to each player in turn, until two cards match in rank. Give the last card to the player who already had a card of that rank."
219,deal,116,Deal back to five,Deal each player enough cards to bring their hand back to five cards.
220,deal,117,One up to each hand,Deal one card up to each hand each player still has in the game.
221,deal,301,Up fours get another down card,"If a player is ever dealt a face up four, deal them an extra down card."
222,deal,301,Sole challenger gets an extra card,"If the last player to declare went in against only one other player, they get an extra card."
223,deal,301,Reveal fours for extra cards,"Each player may reveal any fours they have, and receive an extra card for each one."
224,deal,301,Fours get a card,Anyone who went in with a four gets an extra card.
225,deal,301,Up 4C gets a free down card,"If a player is ever dealt a face up four of clubs, they get an extra down card for free."
226,deal,301,Up pair of twos gets a card,"If a player is ever dealt an up pair of twos, deal them another up card."
227,deal,301,Up twos can buy another card,"If a player is ever dealt a face up two, they may pay max bet to buy another up card."
228,deal,302,Replace duplicates,"If any card in the previous round matched the rank of another card that round, discard it and replace it from the deck."
229,deck,-24,Use a 28 card stripped deck,Take the twos through sevens out of the deck.
230,deck,-20,Use a 32 card stripped deck,Take the twos through sixes out of the deck.
231,deck,-12,"Take out 2s, 8-10, and add four jokers","Take the twos, eights, nines, and tens out of the deck, and add four jokers."
232,deck,-11,Use a 40 card stripped deck with a joker,"Take the eights, nines, and tens out of the deck, and add one joker."
233,deck,-4,Use a pinochle deck,"Use a pinochle deck. That is, shuffle the nine through ace from two decks together. Unless otherwise stated, a straight flush beats five of a kind."
234,deck,-4,Take the twos out and shuffle them separately,Take the twos out of the deck and shuffle them into their own four card deck.
235,deck,1,Add a joker to the deck,Use a 52 card deck with one joker added.
236,deck,2,Add two jokers to the deck,Use a normal 52 card deck with two jokers added.
237,deck,52,Double deck,Shuffle two poker decks together.
238,deck,201,Add one joker per player,"Use a normal poker deck, but add one joker per player."
239,declare,0,Coin in hand (in/out),Declare in/out simultaneously.
240,declare,0,"Coin in hand in/out, high card is in",Declare in/out simultaneously. The high card showing must go in.
241,declare,0,Knock in/out,"Declare in/out one at a time, starting with the player to the left of the dealer."
242,declare,0,"Knock in/out, no pass","Declare in/out one at a time, starting with the player to the left of the dealer. No passing is allowed."
243,declare,0,"Knock in/out, low and paired are in","Declare in/out one at a time, starting with the player to the left of the dealer. Low card showing any anyone paired with another player must go in."
244,declare,0,"Knock in/out, declare both hands","Declare in/out one at a time, starting with the player to the left of the dealer. You must declare separately for your low hand and your high hand."
245,declare,0,"Knock in/out, wilds must go in","Declare in/out one at a time, starting with the player to the left of the dealer. If you are holding a wild card you must go in."
246,declare,0,"Knock in/out, no pass with second chance","Declare in/out one at a time, starting with the player to the left of the dealer, no passes are allowed. If the dealer is the first to go in, everyone else gets a second chance to go in."
247,declare,0,Knock in/out until someone goes in,"Declare in/out one at a time, starting with the player to the left of the dealer. Continue until someone goes in."
248,declare,3,Coin in hand high/low,Declare high/low simultaneously.
249,declare,3,Random high/low declare,Each player randomly declares high or low.
250,declare,3,"High/low declare, up wilds must go high","Each player simultaneously declares high or low, but if you have a face up wild card you cannot declare low."
251,declare,3,High/low declare by flip,"Each player simultaneously flips over one of their remaining down cards. If they flip the one on the right, they are going high; if they flip the one on the left, they are going low."
252,declare,3,Possible high/low declare,"If the table card is six through ten, players simultaneously declare high or low."
253,declare,3,First card declares high/low,"Each player reveals the first down card they were dealt. If it is seven or less they are going low, if it is eight to king they are going high, and if it is an ace they can choose high or low. This card cannot be used in their hand."
254,declare,7,Coin in hand high/low/both,Declare high/low/both simultaneously.
255,declare,7,High/low/both declare hands,Each player simultaneously declares which hand is their high hand and which hand is their low hand.
256,declare,14,High/split-card/both declare,Simultaneous declare of high/split-card/both.
257,declare,16,Declare top hand,The dealer declares one poker hand (such as pair of threes) that will beat all other hands.
258,declare,16,Dealer declares the call rank,The dealer declares one rank to be the call rank.
259,declare,16,Dealer declare rotate rank,The dealer declares one rank to be the rotate rank.
260,declare,16,Dealer declares passing ranks,"The dealer declares one rank as the left passing rank, and another as the right passing rank."
261,declare,16,Declare using first common,Each player simultaneously declares if they are using the first common or not.
262,declare,16,Declare using second common,Each player simultaneously declares if they are using the second common or not.
263,declare,16,Select a common at random,Select one of the common cards at random and place a marker above it.
264,declare,31,Simultaneous high/low/high-card/low-card/multiple declare,"Everyone simultaneously declares if they are going for the high hand, the low hand, the low card, the high card, or some combination thereof."
265,discard,1,Pay max bet or discard for each hand,"For each hand, you must pay max bet or discard one card."
266,discard,1,Discard one and reshuffle,Each player discards a card. The discards are shuffled and placed on top of the deck.
267,discard,1,Discard one,Each player discards one card.
268,discard,1,Discard one,"Each player discards one card. If they discard a card from one of their two card hands, it is replaced by the fifth card."
269,discard,1,Discard one down card,Each player discards one of their down cards.
270,discard,1,Discard up to two,"Each player discards two cards. You can pay double ante to not discard, or ante to discard only one."
271,discard,1,High discards one,The high hand showing must discard one card of their choice.
272,discard,2,Discard one hand,Each player discards one of their two card hands.
273,discard,2,Discard up to two,Each player may discard up to two cards.
274,discard,2,Discard two down cards,Each player discards two down cards.
275,discard,2,Discard the two card hand,Discard your two card hand.
276,discard,2,Discard two,Each player must discard two cards of their choice.
277,discard,3,Discard three down cards,Each player must discard three down cards.
278,discard,4,Discard four,"Each player may discard up to three cards, four if they show an ace. Reshuffle the discards into the deck."
279,discard,5,Discard five down cards,Each player discards five down cards.
280,discard,116,Discard down to four,Each player discards all but four cards.
281,discard,116,Discard down to five,Each player must discard until they have five cards left.
282,discard,301,"Next player discards one, others discard matching",The next player in betting order discards one card. All other players must discard any cards of the same rank.
283,discard,301,Discard if red,Discard the last card flipped if it is a heart or a diamond.
284,discard,301,Discard if black,Discard the last card flipped if it is a club or a spade.
285,discard,301,Discard oldest common,Discard the oldest common card.
286,discard,301,Up pair of threes or fours discards an opponents card,"If a player is ever dealt an up pair of threes or fours, they must choose an opponent's card to discard."
287,discard,301,Winner discards one,Whoever won the auction must discard one card.
288,discard,301,Winner discards or slams one,Whoever won the auction must discard one card. They may slam another player by discarding to them. The slammed player must discard a card and draw the first player's discard.
289,discard,301,Winner discards or slams one,Whoever won the auction must discard one card. They may slam another player by discarding to them. The slammed player must discard a card and draw the first player's discard. The slammed player may also slam a third player.
290,discard,302,Discard or make three hands,"Each player must discard a card from each hand, or make three two card hands."
291,discard,303,Discard any matching the table card,"Discard all cards with the same rank as the last revealed table card, except the last revealed table card."
292,discard,303,Discard any matching the table card and fill voids,"Discard all cards with the same rank as the last revealed table card, except the last revealed table card. Replace any discarded table or common cards, common first."
293,discard,304,Discard cards after jacks,"If a jack is ever dealt face up, the next up card dealt must be discarded, as must all cards of the same rank."
294,discard,603,Discard any matching the table,Discard any cards with the same rank as a table card.
295,discard,603,Discard any matching the table and reante,Discard any cards with the same rank as a table card. If you have no cards you must fold. If you still have card you must reante.
296,discard,603,Discard any matching the table cards,Discard any cards matching the rank of the last four table cards flipped.
297,draw,1,Twist or buy one,Each player may twist a card for max bet or buy a card for double max bet.
298,draw,1,Buy one,Each player in turn may pay max bet to get an up card.
299,draw,1,Twist your bottom card for max bet,"Each player may buy an up card for max bet. They can reject or keep the card, but if they keep the card they must discard the bottom card from their stack."
300,draw,1,Twist one,"Each player may twist a card for max bet. If you twist an up card, you can get the new card down by flipping your hole card."
301,draw,1,"Twist one, get it down for extra","Each player may twist a card for double ante. If they pay max bet instead, they get the new card face down."
302,draw,1,Twist one,Each player may twist one card for max bet.
303,draw,1,Twist one,Each player may twist one card for double max bet.
304,draw,1,Twist one,"Each player starting with low hand showing and going up may twist one card. Up cards cost double ante, down cards cost max bet, and for double max bet you can discard an up card and get a down card back."
305,draw,1,"Mandatory twist, discard up","Each player in turn must pay 5x ante to draw a card, either from the top of the deck or any face up discard. Discards go face up to the table."
306,draw,1,Draw one from deck or discards,Each player may draw one card from the top of the deck or any discard. Discards are face up. Reshuffle the discards if the deck runs out.
307,draw,1,Draw one from deck or discards,Every player except the one who declared he could win may draw one card from the top of the deck or any discard. Discards are face up. Reshuffle the discards if the deck runs out.
308,draw,1,Draw your top card,Each player may discard the top card of their stack and get a new top card in its place.
309,draw,1,One mandatory no peek draw,Each player must discard one card and pick up one of their no peek cards.
310,draw,1,Draw one delayed,Each player may draw one card if they wish. Everyone discards before anyone gets a new card.
311,draw,1,Draw one down card,Each may player may discard one of their down cards to get a new down card.
312,draw,1,Draw one immediately,"Each player may draw one card, but only if they do it immediately after getting their last up card."
313,draw,1,Draw one,Each player may draw one card if they wish.
314,draw,1,One mandatory draw,Each player must draw one card.
315,draw,1,Draw with a down four or less,Any down card that is four or less may be discarded face up for a replacement. Repeat until no one wants to draw.
316,draw,1,Simultaneous declare draw one,Each player may draw one card. Who is going to draw is declared simultaneously.
317,draw,1,Mandatory draw of a down card,Each player must exchange one down card with one table card.
318,draw,1,Twist one,Each player may twist one card for the ante.
319,draw,1,Twist one,Each player may twist one card for double ante.
320,draw,2,Twist two,Each player may twist two cards for double max bet or one card for max bet.
321,draw,2,Twist two,Each player may twist up to two cards for max bet each.
322,draw,2,Twist two,Each player may twist up to two cards for minimum bet each.
323,draw,2,Draw two,Each player may draw up to two cards.
324,draw,2,Mandatory draw of two,Each player must draw two cards.
325,draw,2,"Draw two, discard to the table",Each player may draw up to two cards. Cards discarded in order to draw go face down to the table.
326,draw,2,Draw two or none,Each player may draw exactly two cards.
327,draw,2,"Draw two, staring low","Starting with the lowest hand showing, each player may draw up to two cards if they wish."
328,draw,2,Twist two,Each player may twist up to two cards for double ante each.
329,draw,2,Twist two,Each player may twist up to two cards for an ante each.
330,draw,2,Twist two,Each player may twist exactly two cards for double ante.
331,draw,3,"Twist three, one at a time","Each player may draw three cards, one at a time, for max bet each."
332,draw,3,Twist up to three,Each player may twist up to three cards for minimum bet each.
333,draw,3,"Draw four, get back one less","Each player may discard up to four cards, getting back one less card than they discarded."
334,draw,3,Draw your hole three times,"Each player in turn may discard their hole card for a new one, up to three times each."
335,draw,3,Mandatory draw of one or three,Each player in turn must draw one or three cards.
336,draw,3,Draw three,Each player may draw up to three cards.
337,draw,3,Mandatory draw of three,Each player must draw three cards.
338,draw,3,Draw three no peek,"Each player may draw up to three cards, but they may not look at the cards they are dealt."
339,draw,3,Eights can force a partial reshuffle,"If an eight is dealt face up, the player it was dealt to may call for a twister, where each player gives three cards to the dealer, who shuffles them and redeals them."
340,draw,3,"Draw three, get back one less","Each player may discard up to three cards (four if they show an ace), getting back one less card than they discarded."
341,draw,4,"Delayed draw of three, four with an ace, cards come back up","Each player may draw up to three cards, four if they show an ace. Everyone declares how many cards they are drawing before any cards are dealt. Cards drawn are dealt face up."
342,draw,4,"Reverse order delayed draw of three, four with an ace, cards come back up","Each player starting with the dealer and going counter-clockwise may draw up to three cards, four if they show an ace. Each player declares how many cards they are drawing before cards are dealt. Cards drawn are dealt face up."
343,draw,4,Draw three and pass,"Each player simultaneously declares how many cards they want to draw, up three, four if they have an ace. Your discards go to the player on your left."
344,draw,4,"Draw three, discards to the table","Each player may draw three cards, four if they show an ace. All cards discarded in order to draw go face down to the table."
345,draw,4,"Twist three, four with an ace","Each player may twist up to three cards for max bet each, four if they show an ace."
346,draw,4,"Draw three, four with an ace",Each player may draw up to three cards (four if they show an ace).
347,draw,4,"Draw three, four for the lead","Each player may draw three cards, four for the player to the dealer's left."
348,draw,4,"Draw three, four with an ace, can't draw threes or fours","Each player may draw up to three cards, four if they show an ace. You may not get rid of threes or fours while drawing."
349,draw,4,Draw again or take back,"Each player may draw up the three cards (four if they show an ace), or they may take back their previous draw (after discarding the appropriate number of cards)."
350,draw,4,"Show/hide draw three, four with an ace","Each player flips all five cards face up, and then may draw up to three cards (four if they show an ace). Draw cards come back face down."
351,draw,4,Draw four,Each player may draw up to four cards.
352,draw,5,"Draw three, four with an ace, get an extra back","Each player may discard up to three cards, four if they show an ace, and draw back one more card than they discarded."
353,draw,5,Draw five,Each player may draw up to five cards.
354,draw,7,"Draw three, get an extra for every deuce","Draw three, up to four with an ace, discarding any twos face up, and getting an extra card if you discard any twos"
355,draw,111,Trade in turn,"Each player in betting order may offer a number of cards for trade, but may give no information about those cards. If more than one person wants to make the trade, they must bid for the right, high bid goes to the pot."
356,draw,111,Auction the right to switch hands,Auction off the right to switch hands with the table.
357,draw,301,Discard a four to get rid of a six,Any player may discard a face up four to force another player to discard a face up six. Low hands get to act first.
358,draw,301,You may draw the table card,The player with the table card may take it and replace it with a card from their hand.
359,draw,316,Pick up matching cards in descending order,"Starting with the highest card showing and going in descending order, each player puts all table cards matching rank or suit with their up card into their hand as down cards, then discards their up card to the table."
360,flip,0,Flip the no-peek,Each player flips their no-peek card.
361,flip,1,"Everybody flips one, two discards per game",Each player flips the top card off their stack. Each player must discard two of these cards when flipped during the game.
362,flip,1,Look at your down card,Each player may look at their down card.
363,flip,1,Flip one and choose a hand,"Each player looks at their top card, puts in their low (left) hand or high (right) hand, and all players simultaneously reveal their cards. Neither hand can have more than five cards."
364,flip,1,Flip the top one,Each player simultaneously flips over the top card of their stack.
365,flip,1,Everybody flips one,"Each player flips the top card off their stack, including players who already folded."
366,flip,1,You may flip your hole card,Each player in turn may flip over their hole card.
367,flip,1,Flip one into either hand,"Each player simultaneously flips the top card of their stack, and puts it in either a low hand or a high hand."
368,flip,1,Flip one,Each player flips over one down card of their choice.
369,flip,1,Flip one if you bet,Every player that put money into the pot last round simultaneously flips one card.
370,flip,1,Flip your neighbor's,Each player randomly flips one down card belonging to the player on their left.
371,flip,1,Flip one from last round,Each player flips one of the cards from the last round of dealing.
372,flip,1,Flip one with one refusal/game,"Each player simultaneously flips one down card face up. Once per game, each player may refuse to flip for the rest of the game, but all their further cards will be dealt up."
373,flip,1,Flip one of the two,Each players simultaneously flips the top card of their two card hand.
374,flip,1,Flip one of the three,Each player simultaneously flips the top card of their three card stack.
375,flip,1,Flip one of the four,Each player simultaneously flips the top card of their four card stack.
376,flip,1,Flip one of the five,Each players simultaneously flips the top card of their five card hand.
377,flip,1,"If there's a raise, flip a no peek card","If anyone raises, everyone flips a no peek card."
378,flip,1,"Flip one, or one up if you have only one","Each player flips a down card of their choice. If they only have one card, they get dealt an up card instead."
379,flip,1,You may flip a down ace,Each player in turn may flip over a face down ace if they have one.
380,flip,1,"Flip one, or one up if you have only two","Each player flips a down card of their choice. If they only have two cards, they get dealt an up card instead."
381,flip,2,Flip two down,Each player turns two up cards down.
382,flip,2,Flip two,Each player simultaneously flips two down cards of their choice face up.
383,flip,2,Flip the top two,Each player simultaneously flips the top two cards of their stack face up.
384,flip,2,Flip two into two hands,"Each player simultaneously flips two cards into two hands. They can be split between hands however you want, but no hand can have more than five cards."
385,flip,3,Flip three,Each player simultaneously flips three cards of their choice face up.
386,flip,3,Flip three into different hands,"Each player simultaneously flips three cards into any number of hands. They can be split between hands however you want, but no hand can have more than five cards."
387,flip,112,Flip all cards down,Everyone flips all of their cards face down.
388,flip,113,Flip any number,Each player simultaneously flips over any number of their down cards.
389,flip,116,Flip until you beat,The next player in betting order flips over cards one at a time until they have the best hand showing (counting the first table card as a hand).
390,flip,116,Flip until you beat,"The next player in betting order flips over cards one at a time until either they have the best hand showing (counting the table card as a hand), or they have flipped six cards."
391,flip,116,Flip until you beat,The next player in betting order flips over cards one at a time until they have the best hand showing (counting the table card as a hand). Cards can be flipped from the player's down cards or no peek cards at the player's choice.
392,flip,116,Flip until you beat,The next player in betting order flips over cards one at a time until they have the best hand showing (counting the table card as a hand).
393,flip,117,Flip one from each stack,Each player simultaneously flips one card from each of their stacks.
394,flip,118,Flip the discards,Flip each player's discards.
395,flip,119,Show your cards,Everyone shows their no-peek cards to everyone else.
396,flip,119,Flip the no-peeks,Everyone flips over their no-peek cards.
397,flip,301,Lead flips one,The player to the left of the dealer flips one card face up.
398,flip,301,One player flips one,The next player in betting order flips one card.
399,flip,604,Flip cards that match the table,All players must simultaneously flip any down cards that match the rank of the table cards.
400,fold,-2,Match the pot to get back in,"If you folded, you can match the pot to get your cards back and get back into the game."
