1,bet,0,Reante,Everyone must reante.
789,showdown,3,High/low cards speak,The highest showing high hand and the lowest showing low hand split the pot.
790,showdown,7,High/low/both showdown,High declared high hand and lowest declared low hand split the pot. Hands declared as both must win both to win anything.
791,showdown,7,High/low/both cards speak,The highest showing high hand and the lowest showing low hand split the pot.
792,showdown,7,High/low/both showdown,The highest declared high hand and the lowest declared low hand split the pot.
793,showdown,8,High unique hole wins,"The highest unmatched hole card wins the pot. If no one has a unique card, redeal."
794,showdown,10,"Showdown, high with split-card","Showdown, high hand splits the pot with the split-card"
795,showdown,14,High/split-card/both showdown,The highest declared high hand splits the pot with the best declared split-card.
796,showdown,16,Most points takes the pot,The player with the most points gets the pot.
797,showdown,17,Low hand splits with their neighbor,"Showdown, low hand splits the pot with the closest remaining player to their left"
798,showdown,18,"Showdown, high team splits the pot","Showdown, the team with the highest hand splits the pot. If a team member folded, the remaining partner gets the whole pot."
799,showdown,18,High split,"Showdown, high hand for each flop and turn splits the pot."
800,showdown,18,High hands splits to the left,"Showdown, the high hand splits the pot with the player to their left."
801,showdown,18,High-hand/split-hand showdown,The high hand splits the pot with the split-hand.
802,showdown,19,Rotating showdown,"Each player in turn declares high/low/out. If two players declare the same way, compare hands and loser pays winner the pot. If only one person declares in a direction, they win that pot."
803,showdown,19,High/low/split-hand showdown,The high hand splits the pot with the low hand and the split-hand.
804,showdown,26,"You must have two of high hand, high-card, and low-card","If a player has two of high hand, high-card, and low-card, they win the pot. Otherwise, redeal for all."
805,showdown,31,High/low/high-card/low-card/multiple showdown,"The high declared high hand splits with the low declared low hand, the high declared high card, and the low declared low card. If you declared something and didn't win it, you don't win anything."
806,showdown,64,"High/low showdown, qualifying low takes all","High declared high hand takes the pot, unless there is a qualifying low hand. In that case the low hand takes the pot."
807,showdown,64,"Low showdown for two, high for more","If two people are in the showdown, low hand takes the pot, otherwise high hand the pot."
808,showdown,64,Last jack's showdown,The showdown depends on what game the last player to shift the game called.
809,showdown,64,Lowball if no one could open.,"Showdown, high hand wins unless no one met the opening qualifier, in which case low hand wins."
810,showdown,64,Random showdown,"If the table card is two through five, low hand wins. If it is jack through ace, high hand wins. Otherwise, the highest declared high hand splits the pot with the lowest declared low hand."
811,shuffle,0,Reshuffle if necessary,"If the deck runs out of cards, reshuffle the discards."
812,shuffle,1,Reshuffle discards,Shuffle any discarded cards back into the deck.
813,shuffle,1,Reshuffle the deck,Reshuffle all of the cards into the deck.
814,shuffle,1,Discard and reshuffle,All players discard their hands and the deck is reshuffled.
815,shuffle,1,Shuffle the discards,Shuffle the discards into a table pile.
816,stack,3,Make your draw stack three,Any player who drew less than three cards must put enough cards on top of their stack of cards received until it has three cards.
817,stack,6,Make a stack of four with a card on either side,"Each player puts their cards into a four card stack, with one card on either side."
818,stack,7,Split cards into a three stack and a four stack,Each player splits their cards into a  stack of four cards and a stack of three cards. You may not change the order of the three card stack once betting starts.
819,stack,10,Split cards into two stacks in order,"Each player splits their cards into two hands of five cards each, arranging them in order in face down stacks. The order of the stacks may not change once made."
820,stack,111,Put your cards in a stack,Each player puts their cards in order in a stack face down on the table. The order of the stack may not change once made.
821,stack,111,Make a stack,"Arrange your down and no peek cards in a stack, but do not look at your no peek cards."
822,table,1,Deal a table card for every pair,"Every time a pair is dealt face up, deal a card face up to the table."
823,table,1,One table down,Deal one card face down to the table.
824,table,1,One table up,Deal one card face up to the table.
825,table,1,One table up to the lead,Deal one face up table card to the player to the dealer's left.
826,table,1,"One table up, matches kill","Deal one card face up to the table. If you have a card of that rank in your hand, you must fold."
827,table,1,No second chances,"If a player has a second chance to take the same table card, discard it and replace it instead."
828,table,2,Replace table pairs,"If the last four table cards flipped have a pair, replace the pairing card from the deck until they don't have a pair."
829,table,2,Two table down,Deal two cards face down to the table.
830,table,2,Two table up,Deal two cards face up to the table.
831,table,3,Three table down,Deal three table cards face down.
832,table,3,Three table up,Deal three cards face up to the table.
833,table,4,Four table up,Deal four cards face up to the table.
834,table,4,Deal four table down,Deal four cards face down to the table.
835,table,5,Make sure the table has five cards,"If the table has less than five cards, deal table cards until it does."
836,table,5,Five table down,Deal five cards face down to the table.
837,table,5,Five table up,Deal five cards face up to the table.
838,table,6,Six table down in rows of four and two,"Deal six cards face down to the table in two rows, one of four cards and one of two cards."
839,table,6,Six table down,Deal six cards face down to the table.
840,table,116,Replace table pairs,"If the table cards ever pair, replace the last one from the deck until they don't pair."
841,table,201,One table up each,Deal one table card face up to each player.
842,table,201,One table up per player,Deal a number of up table cards equal to the number of players.
843,table,201,Discard one to the table,Each player discards one card face down to the table.
844,table,202,Two table per player,Deal a number of face down table cards equal to twice the number of players.
845,trade,111,Pay to trade,"Players may trade cards with each other, as long as the same number of cards are traded by each player. No information may be given about the cards except the number offered for trade. Each player may trade up to six times, but must reante each time."
846,turn,1,Flip the top common,Flip the top common card face up.
847,turn,1,Flip the next common going around,Flip the next common card going clockwise around face up.
848,turn,1,Flip the opposite corner,Flip the common card in the corner opposite the last common card flipped.
849,turn,1,Flip the top left common,Flip the top left common card face up.
850,turn,1,Flip the next common going right then down,"Flip the next common card face up, going left to right, and then down."
851,turn,1,Flip first base,Flip the common card on the right side of the diamond.
852,turn,1,Flip one going around widdershins,Flip the next common card going around counter clockwise.
853,turn,1,Flip top middle,Flip the middle card from the first set of commons.
854,turn,1,Flip bottom middle,Flip the middle card from the second set of commons.
855,turn,1,Flip the next common going left then down,"Flip the next common card face up, going right to left, and then down."
856,turn,1,Flip the top middle common card,Flip the top middle common card face up.
857,turn,1,Flip the next common going around and in,"Flip the next common card going clockwise around, and then spiraling in."
858,turn,1,Flip a card from set one,Flip a card from the first set of commons.
859,turn,1,Flip a card from set two,Flip a card from the second set of commons.
860,turn,1,Flip one common card,Flip one common card face up.
861,turn,1,Flip one column,Flip one vertical column of common cards face up.
862,turn,1,Flip a top end,Flip one end card from the first set of commons.
863,turn,1,Flip a bottom end,Flip one end card from the second set of commons.
864,turn,1,Flip any common but the center,Flip over any one common card except the center one.
865,turn,1,"Flip one common card going clockwise, skipping cards","Flip one common card going clockwise around, skipping every other card."
866,turn,1,Flip one top common,Flip one common card from the top row face up.
867,turn,1,Flip one bottom common,Flip one common card from the bottom row face up.
868,turn,1,Flip one table card,Flip one table card face up.
869,turn,2,Flip a pair,Flip one pair of common cards face up.
870,turn,2,"Flip two opposite commons, going clockwise","Flip face up two common cards on opposite sides of the circle face up, going clockwise around."
871,turn,2,Flip two common cards,Flip two common cards face up.
872,turn,2,Flip two from row of four,Flip two cards from the row of four common cards face up.
873,turn,2,Flip the row of two,Flip the commons from the row of two face up.
874,turn,2,Flip two table,Flip two table cards face up.
875,turn,2,Last raiser flips two non-center,The person who was called in the last betting round flips two non-center commons of their choice.
876,turn,3,Flip three common,Flip three common cards face up.
877,turn,4,Flip a row of four,Flip the highest row of unflipped common cards.
878,turn,4,Flip the four corner commons,Flip face up the four common cards in the corners of the square.
879,turn,4,Flip the four edge commons,Flip face up the four common cards on the edge of the square face up.
880,turn,4,Flip four common,Flip four common cards face up.
881,turn,4,Flip four table,Flip four table cards face up.
882,turn,115,Flip one column,Flip one vertical column of common cards.
883,turn,115,Flip the table cards,Flip all of the table cards face up.
884,turn,115,Flip one row,Flip one horizontal row of common cards.
885,turn,401,Flip one common from each row,Flip one common card from each row face up.
886,turn,500,Flip every other common in the circle,Flip every other common card in the circle face up.
887,wild,0,Spades make wilds normal,"If you have a spade in your hand, none of your wilds are wild."
888,wild,0,Terminal kings kill wilds,"If the last card dealt face up is a king, nothing is wild."
889,wild,0,Different wilds cancel,"If you have wild cards with different ranks, none of them count as wild."
890,wild,0,The second face card kills wilds,The second face up face card dealt kills all wilds.
891,wild,0,Wilds only work if you have different wilds,"If you do not have at least two wilds of different rank, none of your wild cards are wild."
892,wild,0,Jokers with wilds kills all wilds,"If you have a joker and a wild card, none of your cards are wild."
893,wild,0,Threes are wild for the table,Threes are wild for the table.
894,wild,0,Declared suit is wild,The dealer declares one suit to be wild.
895,wild,0,Fives are wild for the table,Fives are wild for the table.
896,wild,0,Sevens are wild for the table,Sevens are wild for the table.
897,wild,1,Queen of hearts is a match wild,The queen of hearts is wild if you match the pot.
898,wild,1,Down queen of spades is wild,"If a player has the queen of spades as a hole card, it is wild."
899,wild,1,One eyed king is wild,The one eyed king is wild. This should be the king of diamonds.
900,wild,1,The king of diamonds is wild,The king of diamonds is wild.
901,wild,1,The queen of hearts is wild,The queen of hearts is wild.
902,wild,1,The ace of diamonds is wild,The ace of diamonds is wild.
903,wild,1,The two of spades is wild,The two of spades is wild.
904,wild,1,The bedpost queen is wild,The queen holding a scepter is wild. This is typically the queen of spades.
905,wild,1,the two of diamonds is wild,the two of diamonds is wild.
906,wild,1,The axe king is wild,The king holding an axe is wild. This is typically the king of diamonds.
907,wild,1,The queen of diamonds is wild,The queen of diamonds is wild.
908,wild,1,The nine of diamonds is wild,The nine of diamonds is wild.
909,wild,1,The jack of clubs is wild,The jack of clubs is wild.
910,wild,1,The suicide king is wild,The king with a sword through his head is wild. This is typically the king of hearts.
911,wild,1,The four of diamonds is wild,The four of diamonds is wild.
912,wild,1,The five of diamonds is wild,The five of diamonds is wild.
913,wild,2,First table indicates wild for opposite color,Cards of the same rank but opposite color as the first table card are wild.
914,wild,2,Red eights in the hole are wild,Red eights in the hole are wild.
915,wild,2,Black fours are wild,Black fours are wild.
916,wild,2,One eyed jacks are wild,Jacks with only one eye are wild. This is typically the jacks of hearts and spades.
917,wild,2,Black aces are wild,Black aces are wild.
918,wild,2,Red jacks are wild,Red jacks are wild.
919,wild,2,Black kings are wild,Black kings are wild.
920,wild,2,Black fives are wild,Black fives are wild.
921,wild,2,Red aces are wild,Red aces are wild.
922,wild,2,Black eights are wild,Black eights are wild.
923,wild,2,Red nines are wild,Red nines are wild.
924,wild,2,Red sevens are wild,Red sevens are wild.
925,wild,2,Red fives are wild,Red fives are wild.
926,wild,3,The one-eyed king is triple wild,The one-eyed king can count as any three cards.
927,wild,3,Middle table card indicates wild,"The middle rank table card is wild, as are all cards of the same rank. If there is a pair of table cards, use the pair to indicate wild."
928,wild,3,Last common indicates wild but is not wild,"All cards of the same rank as the last common card are wild, but the last common card is not wild itself."
929,wild,3,Second table indicates wild,Any card of the same rank as the second table card is wild.
930,wild,3,The last table card indicates wild,Any card of the same rank as the last table card is wild.
931,wild,3,First table card indicates wild,Any card of the same rank as the first table card flipped is wild
932,wild,4,Left facing cards are wild,Face cards that face to their left are wild. This is typically the spade face cards and the jack of clubs.
933,wild,4,The high up card indicates wild for low hands,"The highest face up card is wild for low hands, as are all cards of the same rank."
934,wild,4,High up card indicates wild,"The highest up card is wild, as are all others of the same rank."
935,wild,4,The number of players out indicates wild,All cards with the same rank as the number of players who have folded are wild.
936,wild,4,Declared wild,The dealer declares one rank to be wild.
937,wild,4,Up sevens can change the wild card,"If a seven is flipped face up, that player may pick a wild card, which ceases to be wild. Flip the top card off the deck. All cards of the same rank are now wild."
938,wild,4,Twos are wild if you drew once,Twos are wild for anyone who did not take the second draw.
939,wild,4,One-eyed jacks are double wilds,Each one-eyed jack can count as any two cards.
940,wild,4,Last ace picks the wild,The last player to flip over a face down ace chooses what rank is wild (when they flip it over).
941,wild,4,Queens are match wilds,Queens are wild. If you get a queen face up you must match the pot or fold.
942,wild,4,The number of players left indicates match wild,"All cards with the same rank as the number of players left in the game are wild. If you get a wild card face up, you must match the pot or fold."
943,wild,4,Jacks or kings are wild,"Jacks are wild. If a queen is dealt or flipped face up, jacks are not wild and kings are. Each time a queen comes up, the wild changes back and forth between jacks and kings."
944,wild,4,In down table indicates wild,"If the down card was bought, and the purchaser is still in the game, it indicates wild."
945,wild,4,Kings are match wilds,"Kings are wild, but if you get a face up king you must match the pot or fold."
946,wild,4,Highest below seven is wild,"Sixes are wild, but if no one has a six at the showdown, the next lowest rank that someone does have is wild."
947,wild,4,Fours are match wilds.,"Fours are wild, and if you get one face up you must match the pot or fold."
948,wild,4,Sevens are match wilds,"Sevens are wild, but if you get a seven face up you must match the pot or fold."
949,wild,4,Sevens are wild without nines,"Sevens are wild, but if you have a nine, sevens can only be used as wilds to complete a straight flush in their own suit."
950,wild,4,Sevens are wild without nines,"Sevens are wild, but if you have a nine, sevens count as fours that are wild in suit only."
951,wild,4,Tens are match wilds,Tens are wild. If you get a ten face up you must match the pot or fold.
952,wild,4,Last common indicates wild,"The last common card flipped is wild, as are all other cards of the same rank."
953,wild,4,Low common indicates wild,"The low common card is wild, as are all cards of the same rank."
954,wild,4,Queens are wild,Queens are wild.
955,wild,4,The card after the last queen indicates wild,"The face up card dealt after the last face up queen is wild, as are all cards of the same rank."
956,wild,4,Deuces wild,Twos are wild.
957,wild,4,Sixes are wild,Sixes are wild.
958,wild,4,Nines are wild,Nines are wild.
959,wild,4,Aces are wild,Aces are wild.
960,wild,4,Sevens are wild,Sevens are wild.
961,wild,4,Mac OS is wild,The wild rank is equal to the latest edition of the Macintosh operating system.
962,wild,4,Fives are wild,Fives are wild.
963,wild,4,Kings are wild,Kings are wild.
964,wild,4,Kings are wild going high,Kings are wild in high hands.
965,wild,4,Threes are wild,Threes are wild.
966,wild,4,The card after a pair indicates wild,"The face up card dealt after the last face up pair is wild, as are all cards of the same rank."
967,wild,4,Fours are wild,Fours are wild.
968,wild,4,The passing rank is wild,Whatever rank the dealer declared as the passing rank is wild.
969,wild,4,The number of players left indicates wild,All cards with the same rank as the number of players left in the game are wild.
970,wild,4,Cards dealt after face cards and aces are wild,"The face up card after the last face up face card or ace is wild, as are all cards of the same rank."
971,wild,4,Jacks are wild,Jacks are wild.
972,wild,4,The card after the ace indicates wild,"The face up card dealt after the last face up ace is wild, as are all cards of the same rank."
973,wild,4,Eights are wild,Eights are wild.
974,wild,4,Table plus one indicates wild,All cards with a rank one higher than the table card are wild.
975,wild,4,Twos are pay wilds,Twos cost ante to make wild.
976,wild,4,Sixes are match or discard wilds,"Sixes are wild, but if you get one face up you must match the pot or discard it."
977,wild,4,Cards after red queens indicate wild,"The card dealt up after the last face up red queen is wild, as are all other cards of the same rank."
978,wild,4,Threes are match wilds,"Threes are wild, but if you get one face up you must match the pot or fold."
979,wild,4,Threes are wild for high,Threes are wild in high hands.
980,wild,4,Low of first up cards indicates wild,"Of the first up cards seen, the lowest is wild, as are all cards of the same rank."
981,wild,4,The common indicates wild,"The common card is wild, as are all cards of the same rank."
982,wild,4,The card after the last king indicates wild,"The face up card after the last face up king is wild, as are all cards of the same rank."
983,wild,4,Down queens are wild,Face down queens are wild.
984,wild,4,One three is wild high,Each player can use one three as a wild in their high hand.
985,wild,4,The card after the last five indicates wild,"The card dealt after the last face up five is wild, as are all cards of the same rank."
986,wild,4,"Threes are wild, pay for up threes",Threes are wild in the hole. If you get one face up you must pay ante to make it wild.
987,wild,4,Twos are wild with a king and queen,"If you have a king and a queen, all of your twos are wild."
988,wild,4,Fours are pay wilds,"Four are wild, but you must pay half the pot to make them wild."
989,wild,4,Fives are wild with at least five cards,Fives are wild in five-card hands and seven-card hands.
990,wild,4,Twos are wild with wild threes,"If you have a wild three, all of your twos are wild."
991,wild,4,The die roll indicates wild,The rank equal to the die roll is wild.
992,wild,4,Hand size indicates wild,The rank that is wild is equal to the number of cards you have in your hand.
993,wild,4,The sum of the dice is wild,The rank equal to the sum of the dice are wild.
994,wild,4,The low up card indicates wild for high hands,"The lowest face up card is wild for low hands, as are all cards of the same rank."
995,wild,4,Up cards after black fives indicate wild,"The last face up card after the last face up black five is wild, as are all cards of the same rank."
996,wild,4,Sixes are pay wilds,Sixes cost max bet to make wild.
997,wild,4,Nines are match or discard wilds,"Nines are wild, but if you get one face up you must match the pot or discard it."
998,wild,4,Cards before black queens indicate wild,"The up card dealt before the last face up black queen is wild, as are all cards of the same rank."
999,wild,4,Nines are match wilds,"Nines are wild, but if you get one face up you must match the pot or fold."
1000,wild,4,Tens are wild,Tens are wild.
1001,wild,4,Kings are wild for low,Kings are wild in low hands.
1002,wild,4,High of first up cards indicates wild,"Of the first up cards seen, the highest is wild, as are all cards of the same rank."
1003,wild,4,One king is wild low,Each player can use one king as a wild in their low hand.
1004,wild,4,"Sixes are wild, pay for up sixes",Sixes are wild in the hole. If you get one face up you must pay double ante to make it wild.
1005,wild,4,"Nines are wild, pay for up nines","Nines are wild in the hole. If you get one face up, you must pay max bet to make it wild."
1006,wild,4,Threes are wild with a king and a queen,"If you have a king and a queen, all of your threes are wild."
1007,wild,4,Fours are wild with a king and a queen,"If you have a king and a queen, all of your fours are wild."
1008,wild,4,Tens are pay wilds,"Tens are wild, but you must pay the value of the pot to make them wild."
1009,wild,4,Sevens are wild with seven cards,Sevens are wild in seven-card hands.
1010,wild,4,Threes are wild with a four,"If you have a four, all of your threes are wild."
1011,wild,4,The last common minus the die roll indicates wild,"The rank equal to the last common's rank minus the die roll is wild, if that rank is above zero."
1012,wild,4,Fives are wild with five cards,Fives are wild in five-card hands.
1013,wild,4,Flip after queen indicates wild,"The card flipped after the last flipped queen is wild, as are all cards of the same rank."
1014,wild,6,First two tables indicate wild,"The first two table cards flipped are wild, as are all cards of the same rank."
1015,wild,6,The winning two cards indicate wild,"The cards from the winning two card hand are wild, as are all cards of the same rank, but not for the winning hand."
1016,wild,6,Two queens and a guy are wild,"If you have two queens and a jack or a king, all three are wild."
1017,wild,8,"Sixes and sevens are wild, but change the wilds","Sixes and sevens are wild. If a six or seven is dealt face up, fives and eights are wild. Each time a wild is dealt face up, the low wild shifts down one rank, and the high wild shifts up one rank."
1018,wild,8,"Sixes and sevens are wild, but change the wilds","Sixes and sevens are wild. If a six or seven is dealt face up, fives and eights are wild. Each time a wild is dealt face up, the low wild shifts down one rank, and the high wild shifts up one.  If a jack is dealt face up, sixes and sevens are wild again."
1019,wild,8,Little opposite wilds,"The two lowest common cards of the opposite color of the low common are wild, as are all of the same rank. If the low common is paired with an opposite color, there is no wild."
1020,wild,8,Little opposite for high,"For high hands, the two lowest common cards of the opposite color of the low common are wild, as are all of the same rank. If the low common is paired with an opposite color, there is no wild for high hands."
1021,wild,8,Big Opposite for low,"For low hands, the two highest common cards of the opposite color of the high common are wild, as are all of the same rank. If the high common is paired with an opposite color, there is no wild for low hands."
1022,wild,8,Twos are double wilds,Twos can count as any two cards.
1023,wild,8,Sixes and nines make each other wild,"If you have a six and a nine, they're both wild."
1024,wild,8,Sums to five are wild.,Any two cards that add to five count as one wild card.
1025,wild,8,The individual dice indicate wild,The ranks equal to each individual die are wild.
1026,wild,9,Queens make numbers wild,The two through ten of the same suit as the last face up queen are wild.
1027,wild,12,Pairs that add to seven are wild,Any two cards that add to seven count as one wild.
1028,wild,12,Cards that multiply to nine are wild,Any two cards that multiply to nine make each other wild.
1029,wild,13,Hearts are wild if you have a queen,Hearts are wild if you have a queen.
1030,wild,13,Diamonds make hearts wild,Hearts are wild if they have a matching diamond. Each heart requires a separate diamond.
1031,wild,13,Hearts are match wilds,Hearts are wild. If you get a heart face up you must match the pot or fold.
