1,bet,0,Reante,Everyone must reante.
2,bet,0,Two pots,"Ante twice, into a high pot and a low pot."
3,bet,0,Reante,Everyone must reante to each remaining pot.
4,bet,0,Reante to both,Everyone must reante to both pots.
5,bet,0,No ante,Players do not ante.
6,bet,0,Reante if you match to get in,"Players who have folded, but have a joker or a card of the same rank as the table card, may reante to get back into the game."
7,bet,0,Reante for each card,"Each player must reante once for each card they have, including the one they are about to be dealt."
8,bet,1,Lead bet with forced open,"Normal betting round, starting with the player to the dealer's left, who must bet."
9,bet,1,Left of last raiser forced bet,"Betting round, starting with the player to the left of the person called in the last round of betting, who must bet."
10,bet,1,Lead bet for the low pot,"Lead bet for the low hand, all bets go into the low pot."
11,bet,1,Lead bet for the high pot,"Lead bet for the high hand, all bets go into the high pot."
12,bet,1,"Lead bet, pay to fold","Normal betting round, starting with the player to the dealer's left. In order to fold you must pay max bet."
13,bet,1,Last raiser must bet,"Betting round, starting with the last person called in the last round, who must bet."
14,bet,1,Last winner must bet,"Betting round, starting with the person who won the last hand, who must bet."
15,bet,1,"Lead bet, bet multiples of the pot","Betting round, starting with the player to the left of the dealer. Players bet how many times they will match the pot, up to triple the pot."
16,bet,1,High bet with force open,"Normal Betting round, starting with the high hand showing, who must bet or fold."
17,bet,1,"High bet, no pass","Normal betting round, with the high hand opening. You may not check/pass, you must bet or fold."
18,bet,1,Rotating lead bet with increasing blind,"Lead bet, first round starts to the left of the dealer, subsequent rounds rotate clockwise around the table, with a blind bet."
19,bet,1,Lead bet with a blind,"Betting round, starting with the player to the dealer's left, with one blind bet."
20,bet,1,Combined lead bet,"Betting round, starting with the player to the left of the dealer. Both players must bet the hand, if one folds, the other must be double."
21,bet,1,Lead bet,"Normal betting round, with the player to the left of the dealer opening."
22,bet,1,High bet,"Normal betting round, with the player with the high hand showing opening."
23,bet,1,Left of last raiser bets,"Betting round, starting with the player to the left of the person called in the last round of betting."
24,bet,1,Lead bet if anyone twisted,"If any player twisted, there is an additional betting round starting with the player to the dealer's left."
25,bet,1,Low bet,Normal betting round starting with the player with the lowest hand showing.
26,bet,1,Last raiser bets,"Betting round, starting with the last person to raise."
27,bet,1,"Lead bet, no pass","Normal betting round, with the player to the left of the dealer opening, you may not pass (check)."
28,bet,1,"Lead bet, jacks to open","Normal betting round, with the player to the left of the dealer opening, you must have a pair of jacks or better to open."
29,bet,1,Rotating bet,"Normal betting round, first round starts to the left of the dealer, subsequent rounds start rotate around the table."
30,bet,1,Lead bet,"If the player who just flipped cards didn't fold, normal betting round starting with that player."
31,bet,1,"Lead bet, match the pot to fold","Normal betting round, with the player to the left of the dealer opening. You must match the pot to fold."
32,bet,1,"Lead bet, kings to open","Normal betting round, with the player to the left of the dealer opening, you must have a pair of kings or better to open. If no one opens, reante and redeal."
33,bet,1,"Lead bet, queens to open","Normal betting round, with the player to the left of the dealer opening, you must have a pair of queens or better to open. If no one opens, reante and redeal."
34,bet,1,"Lead bet, aces to open","Normal betting round, with the player to the left of the dealer opening, you must have a pair of aces or better to open. If no one opens, reante and redeal."
35,bet,1,"Lead bet, four flush or jacks to open","Normal betting round, with the player to the left of the dealer opening, you must have a pair of jacks or better or a four card flush to open. If no one opens, reante and redeal."
36,bet,1,"If no one opens, forced open","If no one opened in the previous round of betting, the player to the left of the dealer must open with at least double ante."
37,bet,1,Lead bet with two blinds,"Betting round, starting left of the dealer, with two blinds."
38,bet,1,Lead bet with two blinds and a straddle,"Betting round, starting left of the dealer, with two blinds and a straddle."
39,bet,1,"Lead bet, three bump limit per game","Normal betting round, with the player to the left of the dealer opening. The pot may only be raised three times in the game."
40,bet,2,"Lead bet, bet each hand","Betting round, starting with the player to the left of the dealer. You must bet each hand the same, unless you fold one of them."
41,bet,2,"High bet, bet both hands","Betting round starting with the high hand showing. You must make identical bets for both hands, unless you fold one of them."
42,common,-2,The lead discards two commons,The player to the left of the dealer chooses two common cards to be discarded.
43,common,1,One common up,Deal one common card face up to the table.
44,common,1,Deal one common on up sixes,"If a player is ever dealt a face up six, deal one common card face up."
45,common,2,One and one common up,Deal two sets of one face up common card each.
46,common,2,"Deal two commons up, one right and one below","Deal two commons face up to the table, one to the right of the 3x3 grid, one below it."
47,common,2,Two common up,Deal two common cards face up to the table.
48,common,3,Three common down in an 'L',Deal three common cards face down in an 'L' shape.
49,common,3,Three common down,Deal three common cards face down.
50,common,3,Three common down in a V,Deal three common cards face down in a V pattern.
51,common,3,Three common up,Deal three common cards face up to the table.
52,common,4,"Deal four common up, two on the right, two below","Deal four common cards face up to the table. Deal two the right of the 3x3 grid, and two below it."
53,common,4,Four common down in a square,Deal four face down common cards in a 2x2 square.
54,common,4,Four common down in a diamond,Deal four common cards face down in a diamond.
55,common,4,Four common down,Deal four common cards face down.
56,common,4,Four common down in a Z,"Deal four common cards down in a Z formation, so that the last card in the top row is above the first card in the bottom row."
57,common,4,Four common up,Deal four common cards face up.
58,common,5,Four commons down in a cross around a joker,"Deal four face down common cards in a cross, and put a joker in the center of the cross."
59,common,5,Five common down in a cross,Deal five common cards face down in a cross pattern.
60,common,5,Five common up,Deal five common cards face up.
61,common,5,Five common down in a V,Deal five common cards face down in a V pattern.
62,common,5,Five common down in an L,Deal five common cards face down in an L pattern.
63,common,5,Five common down,Deal five common cards face down.
64,common,6,Two flops,Deal two sets of three face up common cards each.
65,common,6,Two flops down,Deal two sets of three face down common cards each.
66,common,6,Six common down in a circle,Deal six common cards face down in a circle.
67,common,6,Six common down,Deal six common cards face down.
68,common,7,Six common down in a circle and one in the middle,"Deal six common cards face down in a circle, and deal a seventh face down in the middle of the circle."
69,common,7,Seven common down in three rows,"Deal seven common cards down in a row of four, a row of two, and a row of one."
70,common,7,Seven common down in an 'H',Deal seven common cards face down in an 'H' formation.
71,common,8,Eight commons down in four rows,Deal four rows of two face down common cards each.
72,common,8,Eight commons down in two rows,Deal two rows of four face down common cards each.
73,common,8,Eight commons down in a circle,Deal eight common cards face down in a circle.
74,common,8,Eight commons down in a square,Deal eight common cards face down in a square.
75,common,9,Eight commons down in a circle and one in the middle,"Deal eight common cards face down in a circle, and deal a ninth down in the middle of the circle."
76,common,9,"Three rows of down common cards: four, three, and two.","Deal three rows of face down common cards, a row of four, a row of three, and a row of two."
77,common,9,Three flops,Deal three sets of three face up common cards each.
78,common,9,Nine commons down in a square,Deal nine face down common cards in a 3x3 square.
79,common,9,Nine down commons in a cross,Deal nine face down common cards in a 5x5 cross.
80,common,10,Ten common down in five rows,Deal five rows of two face down common cards each.
81,common,10,Ten common down in two rows,Deal two rows of five face down common cards each.
82,common,10,Ten commons down,Deal ten face down common cards.
83,common,12,Twelve common down in six rows,Deal six rows of two face down common cards each.
84,common,15,Three rows of five commons,Deal three rows of five face-down common cards each.
85,common,16,16 commons down in a square,"Deal 16 commons face down to the table, in a 4x4 square."
86,common,25,Twenty five commons down in a square,Deal twenty five commons face down in a 5x5 square.
87,dead,4,Twos are dead,Twos do not count toward hand value.
88,dead,4,Kings are dead,Kings do not contribute to hand value.
89,dead,4,Fours are dead,Fours do not contribute to hand value.
90,dead,4,Tens are dead,Tens do not contribute to hand value.
91,dead,109,Jokers in hand are dead,Jokers in player hands do not count toward hand value.
92,dead,109,Queens kill jokers,"After a queen is dealt face up, jokers no longer contribute to hand value."
93,dead,200,Second and later spades are dead,"None of the spades in your hand contribute to hand value, except the first one."
94,dead,204,Third flipped indicates dead for you,"Each player's third flipped no peek card does not contribute to their hand value, nor do any other cards of the same rank, even if that rank was wild."
95,deal,1,Buy one,Each player in turn may match the pot to get an extra down card.
96,deal,1,Buy one,Each player may buy a down card for half the pot.
97,deal,1,Buy one,"Each player in turn may buy the oldest table card for the ante, the newest table card for double ante, or the top card of the deck for max bet. If the deck card is bought it stays down, otherwise deal a new table card."
98,deal,1,Buy one,"Each player in turn may buy the oldest table card for the ante, the second oldest for double ante, the newest table card for triple ante, or the top card of the deck for max bet. If the deck card is bought it stays down, otherwise deal a new table card."
99,deal,1,Buy one,"Each player in turn may buy the oldest table card for the ante, the second oldest for double ante, the newest table card for max bet, or the top card of the deck for free. If the deck card is bought it stays down, otherwise deal a new table card."
100,deal,1,Buy one,"Each player in turn may buy the oldest table card for free, the second oldest for the ante, the newest table card for double ante, or the top card of the deck for max bet. If the deck card is bought it stays down, otherwise deal a new table card."
101,deal,1,Up jacks can buy a down card,"If a player is ever dealt a face up jack, they may buy a down card for max bet."
102,deal,1,Buy one,"Each player in turn may buy first up table card for ante, second for 2x ante, third for max bet, top deck card for free, or down table for the pot + 2x max bet/player. If deck card or down table is bought it stays down, otherwise deal a new table card."
103,deal,1,"One down, pay to get it up",Deal each player one face down card. They may pay max bet to get it face up instead
104,deal,1,"One up, pay to get it down",Deal each player one face up card. They may pay max bet to get it down.
105,deal,1,"One down, left can pay for up","Deal one card down to each player. If the player to your left pays max bet, you get your card up."
106,deal,1,Auction one,"Deal one card face up for each player. Each player secretly puts a bid from min bet to max bet in their hand. Cards are distributed from high down in order of bid, eldest bid breaks ties."
107,deal,1,"One up, can pay to pass","Deal one up to each player. You may pay minimum bet to pass it to the player on your left instead, even if it was passed to you. If the dealer rejects the card, it is discarded"
108,deal,1,"One up, can pay to pass","Deal one card up to each player. You can pay max bet to pass the first card you get this round, even if it was passed to you."
109,deal,1,"One up, can pay to pass","Deal one card up to each player. You can pay double max bet to pass the first card you get this round, even if it was passed to you."
110,deal,1,"One up, can pay to pass","Deal one card up to each player. You can pay quadruple max bet to pass the first card you get this round, even if it was passed to you."
111,deal,1,"One up, can pay to pass, rotating deal","One up to each player, rotating the start one player left each round. You can pass your first card each round if you pay minimum bet, even it was passed to you, and get the top card off the deck instead. If a card makes it past the dealer it is discarded."
112,deal,1,Take the table or buy one,"Each player may take the table card or pay max bet to get one dealt up to them from the deck. If they take the table card, replace it."
113,deal,1,Auction one card,"Players bid on the table card in betting order, the leader (who rotates) must bid ante."
114,deal,1,Auction one card,"Players bid on the table card in betting order, the leader (who rotates) must bid ante, and players who have won an auction cannot bid."
115,deal,1,"Flip until match, deal it to matching hand",Flip cards over from the deck until a card matches the rank of player's card. Deal the card to that player.
116,deal,1,Buy one,"Each player in turn may buy the oldest table card for the ante, the next oldest for double ante, then quadruple, then octuple; or the top card of the deck for free. If the deck card is bought it stays down, otherwise deal a new table card."
117,deal,1,Buy one,"Each player in turn may buy the oldest table card for the ante, the second oldest for double ante, the newest table card for triple ante, or get the top card of the deck for free. If the deck card is bought turn it up, otherwise deal a new table card."
118,deal,1,Buy one,"Each player in turn may buy the oldest table card for free, the newest table card for the ante, or the top card of the deck for double ante. If the deck card is bought it stays down, otherwise deal a new table card."
119,deal,1,One down,Deal one card down to each player.
120,deal,1,One up,Deal one card up to each player.
121,deal,1,One no-peek to you,"Deal one card down to each player. You may not look at this card, but you must show it to all other players."
122,deal,1,"One up, can be rejected","Deal one up to each player. A player may reject any card he is dealt, forcing the player to their left to take it. Deal continues in clockwise order (never reverse) until everyone has a card."
123,deal,1,One up or down,"Deal one up to each player, but deal it down if they don't currently have a down card."
124,deal,1,One down no-peek,Deal one card down to each player. No player may look at this card.
125,deal,1,One down if no one's in,"If no one goes in, deal one card down to each player."
126,deal,1,One up if you want it,"Deal each player one card face up, if they want it."
127,deal,1,"One up if you want it, no pass","Deal each player one card face up, if they want it and if they got a card dealt to them last round."
128,deal,1,"One up if you want it, no triple pass","Deal each player one card face up, if they want it and if they haven't declined a card three times in a row."
129,deal,1,One up or down,"Deal one up to each player, they may get it down by flipping over a down card."
130,deal,1,"One up, can pass it","Deal one up to each player. A player can pass the first card he gets each round, even it was passed to him, and get the top card off the deck instead. If a card makes it past the dealer it is discarded."
131,deal,1,"One up, can pay to pass","Deal one up to each player. A player can pass the first card he gets each round if they pay double ante, even it was passed to him, and get the top card off the deck instead. If a card makes it past the dealer it is discarded."
132,deal,1,"One up, can pass it","Deal one up to each player. A player can pass the first card he gets each round, even it was passed to him, and get the top card off the deck instead. If a card makes it past the dealer it becomes the first card dealt in the next round."
133,deal,1,"One up, one switch per game",Deal one up to each player. Once per game each player may switch the card dealt to them with the next card off the deck. This must be done before the next player is dealt a card.
134,deal,1,One down with up to three rejections,"Deal one down to each player. As the cards are dealt, each player may reject (discard) their card to get another, up to three times."
135,deal,1,Draft one,"Deal one card up to the table per player. Starting with the low hand and going up in hand order, each player picks one of the cards and adds it to their hand."
136,deal,1,"One down, two rejections per game",Deal one card down to each player. Twice during the game each player may reject their dealt card and get another one.
137,deal,1,"One up, two rejections per game",Deal one card up to each player. Twice during the game each player may reject their dealt card and get another one.
138,deal,1,"One up, can reject one",Deal one up to each player. Each player may reject the first card they are dealt each round and take the top one off the deck instead.
139,deal,1,One up or down,"Deal one to each player, up or down at their choice, no player may have more than three down cards."
140,deal,1,"Auction one card, one up to the rest","Auction the top card off the deck, the winner can take the card or give it to a player of their choice. Deal everyone else one card face up."
141,deal,1,"One up, can pay to pass","Deal one up to each player. You may pay double last round's passing fee to pass it to the player on your left instead, even if it was passed to you. If the dealer rejects the card, it is discarded."
142,deal,1,"One up, down to out players","Deal one card up to each player, and one card down to every player who has folded."
143,deal,1,"One down, even to out players","Deal one card down to each player, even if they previously folded."
144,deal,1,"One up, even to out players","Deal one card up to each player, including players who have folded earlier in the round. If an out player gets a face up spade, they are back in the game."
145,deal,1,One up or down,"Deal one down to each player, they may get it up if they want."
146,deal,1,Rotating one up with extra pass,"Deal one card up with each player, the lead player rotating clockwise each round. Deal an extra up card to the lead. Starting with the lead, each player may pass one up card to their left. The last player discards one up card instead."
147,deal,1,One up or down,"Deal a down card to each player, but players who already have two down cards get an up card instead."
148,deal,1,Fours give everyone a card,"If a common four is dealt face up, deal each player an extra down card."
149,deal,1,Go fish or one up if you want it,"Each player in turn may ask another player if they have a down card of a particular rank. If the other player does, the asker gets the card, otherwise they get the top card off the deck."
150,deal,1,Pick one,"Each player in turn may pick a table card or the top card off the deck and add it to their hand. Deck cards are flipped up, table cards are replaced."
151,deal,1,Auction one,Auction off the top card off the deck.
152,deal,1,Iterative auction,"Auction the top card off the deck. The winner discards a card, which is then auctioned. Repeat until no one wants the card."
153,deal,1,Auction or buy one,"Flip one card, highest bidder gets it. Repeat until each player wins a card, players who have won a card this round may not bid. If at any point no one wants a card, the remaining players pay double ante for one card off the deck."
154,deal,1,Auction one,"Flip one card, highest bidder gets it. Repeat once for each player, players who have won three cards may not bid. If at any point no one wants a card, the remaining players pay double ante for one card off the deck."
155,deal,1,Pick one,"Each player in turn may pick a table card or the top card off the deck and add it to their hand. Deck cards stay down, table cards are replaced."
156,deal,1,"One up, pay to pass","Deal one up to each player. You may pay minimum bet to pass your first up card each round to the player on your left instead, even if it was passed to you, and max bet to pass your second. If the dealer passes, it is discarded."
157,deal,1,"One down or up, pay to pass","Deal one down to each player, you can get it up if they want. You may pay minimum bet to pass your first up card each to the player on your left instead, even if it was passed to you, and max bet to pass your second. If the dealer passes, it is discarded."
158,deal,1,Buy one,Each player in turn may buy one down card for max bet.
159,deal,1,Buy one,"Each player in turn may buy one table card or the top card off the deck.  Ranks two through five cost max bet, six through king cost double ante, and ace costs double max bet. Deck cards are flipped up to determine price, but all cards are dealt to players down."
160,deal,1,Flipped fours may buy a card,"If any player ever flips a four face up, they may buy another down card for max bet. In the case of multiple fours in the same round, start with the player to the left of the deal and go around."
161,deal,1,Up fours can buy a down card,"If a player ever flips a four face up, they may pay max bet to buy another down card."
162,deal,1,Up fours can buy another card,"If a player is ever dealt a face up four, they may pay max bet to buy another up card."
163,deal,1,Keep one,Add one of your down cards to your permanent hand.
164,deal,1,"If the second no peek is flipped, draw it","If the second no peek card is flipped face up, each player add theirs to their hand."
165,deal,2,"One up or down, can pay to pass up","Deal one down to each player, they can get it up if they want. You may pay minimum bet to pass an up card to the player on your left instead, even if it was passed to you. If the dealer rejects the card, it is discarded."
166,deal,2,Deal a two to each player,Deal one of the twos face down to each player.
167,deal,2,One down twice,Deal two hands of one card face down to each player.
168,deal,2,Two down,Deal two cards down to each player.
169,deal,2,Two up,Deal two cards up to each player
170,deal,2,Two no peek,Deal two cards face down to each player. No player may look at these cards.
171,deal,3,Three down,Deal three cards face down to each player.
172,deal,3,Three no peek,"Deal three cards down to each player, they may not look at these cards."
173,deal,3,Three up,Deal three cards face up to each player.
174,deal,3,Three up or down,"Deal three to each player, up or down at their choice, no player may have more than three down cards."
175,deal,3,Each player picks a table set,"Each player in turn picks one up table card and the two down table cards that goes with it, and put them in their hand."
176,deal,3,All pass means new kitty,"If no one goes in, deal another three table cards down as another kitty."
177,deal,4,Four down,Deal four cards down to each player.
178,deal,4,Four down no peek,Deal four cards down to each player. No player may look at these cards.
179,deal,5,Five down,Deal five cards face down to each player.
180,deal,5,Five down no peek,Deal five cards down to each player. No player may look at these cards.
181,deal,6,Three down twice,Deal each player two sets of three down cards.
182,deal,6,Six down,Deal six cards face down to each player.
183,deal,6,Six down no peek,Deal six cards face down to each player. No player may look at these cards.
184,deal,7,Seven down,Deal seven cards face down to each player.
185,deal,7,Seven down no peek,Deal seven cards down to each player. No player may look at these cards.
186,deal,8,Four sets of two down,Deal each player four sets of two down cards each.
187,deal,8,Eight down,Deal eight cards face down to each player
188,deal,9,Nine down,Deal nine cards face down to each player.
189,deal,10,Ten down,Deal ten cards face down to each player.
190,deal,10,Ten down no peek,Deal ten cards face down to each player. No player may look at these cards.
191,deal,12,Twelve down no peek,Deal twelve cards down to each player. No player may look at these cards.
192,deal,13,Thirteen down,Deal thirteen cards face down to each player.
193,deal,15,Fifteen down,Deal fifteen cards face down to each player.
194,deal,110,Table matches common means redeal,"If the last table card is the same rank as the last common card, redeal the game."
195,deal,110,Common face cards force a redeal,"If flipping a common ever reveals a face card, redeal."
196,deal,110,Up QS forces redeal,"If the queen of spades is ever dealt face up, redeal."
197,deal,110,"King of hearts forces redeal, but queen of hearts saves","At the showdown, if a king of hearts was ever dealt face up, redeal the game. However, if the queen of hearts was dealt face up after the king of hearts, or revealed at the showdown, do not redeal."
